{"opportunities":[{"opportunityKey":"core-trac:64321","opportunityRevision":"opportunity-revision-v1-f11dc432071843240403addf218a84f4","rank":1,"score":197,"ticketId":"64321","tier":"immediate"},{"opportunityKey":"core-trac:65683","opportunityRevision":"opportunity-revision-v1-8e8ca997d1839d314b2960bf82877b3f","rank":2,"score":191,"ticketId":"65683","tier":"immediate"},{"opportunityKey":"core-trac:65661","opportunityRevision":"opportunity-revision-v1-dd63f0847681e6054ff1b0030cc071fa","rank":3,"score":186,"ticketId":"65661","tier":"immediate"},{"opportunityKey":"core-trac:63568","opportunityRevision":"opportunity-revision-v1-f802f62bd2e1298aefd16152c3e72cd8","rank":4,"score":182,"ticketId":"63568","tier":"immediate"},{"opportunityKey":"core-trac:64480","opportunityRevision":"opportunity-revision-v1-b4d65e1a038097f9607322dc46012a9c","rank":5,"score":178,"ticketId":"64480","tier":"immediate"},{"opportunityKey":"core-trac:14060","opportunityRevision":"opportunity-revision-v1-00c0b7a1f9f82bdff0b0779745d06c25","rank":6,"score":174,"ticketId":"14060","tier":"immediate"},{"opportunityKey":"core-trac:65746","opportunityRevision":"opportunity-revision-v1-7db8c26192cb1d4e3f5d562cbfa76a0d","rank":7,"score":172,"ticketId":"65746","tier":"immediate"},{"opportunityKey":"core-trac:39004","opportunityRevision":"opportunity-revision-v1-d66ef3c9a191f0d16bf12e14a327abc2","rank":8,"score":171,"ticketId":"39004","tier":"immediate"},{"opportunityKey":"core-trac:21989","opportunityRevision":"opportunity-revision-v1-71eab8d3276b9dbe935b473d63c01743","rank":9,"score":166,"ticketId":"21989","tier":"immediate"},{"opportunityKey":"core-trac:33073","opportunityRevision":"opportunity-revision-v1-2c7e7a841425b0e9c87b3cc13f676713","rank":10,"score":166,"ticketId":"33073","tier":"immediate"},{"opportunityKey":"core-trac:63013","opportunityRevision":"opportunity-revision-v1-38c100acd193a16630ea957166be661d","rank":11,"score":166,"ticketId":"63013","tier":"immediate"},{"opportunityKey":"core-trac:64810","opportunityRevision":"opportunity-revision-v1-5de67ba247590fd4057ae79f0e3721a2","rank":12,"score":166,"ticketId":"64810","tier":"immediate"},{"opportunityKey":"core-trac:65638","opportunityRevision":"opportunity-revision-v1-e30e928717f43b3414973ea795d9cd1a","rank":13,"score":166,"ticketId":"65638","tier":"immediate"},{"opportunityKey":"core-trac:42670","opportunityRevision":"opportunity-revision-v1-a8caf2327743abd4143d1dd012388b86","rank":14,"score":164,"ticketId":"42670","tier":"strong"},{"opportunityKey":"core-trac:56320","opportunityRevision":"opportunity-revision-v1-fa100fc74056fac70d4dd44e157be88c","rank":15,"score":164,"ticketId":"56320","tier":"strong"},{"opportunityKey":"core-trac:65515","opportunityRevision":"opportunity-revision-v1-539ec7a15b04b11458c2aa2560d68a42","rank":16,"score":164,"ticketId":"65515","tier":"strong"},{"opportunityKey":"core-trac:65551","opportunityRevision":"opportunity-revision-v1-67dec24711aa3c5b06cb7bea4953b5c2","rank":17,"score":164,"ticketId":"65551","tier":"strong"},{"opportunityKey":"core-trac:65897","opportunityRevision":"opportunity-revision-v1-cbea3a97c6d7300d584d1f8b8d9eeee6","rank":18,"score":164,"ticketId":"65897","tier":"strong"},{"opportunityKey":"core-trac:66031","opportunityRevision":"opportunity-revision-v1-6f541a18f036cd47eba10c075946ec69","rank":19,"score":163,"ticketId":"66031","tier":"strong"},{"opportunityKey":"core-trac:40370","opportunityRevision":"opportunity-revision-v1-b0f36e06d3512681bcb2b667cc4fabbe","rank":20,"score":160,"ticketId":"40370","tier":"strong"},{"opportunityKey":"core-trac:48522","opportunityRevision":"opportunity-revision-v1-ad68501fbd1494b62d93545165b3d8b7","rank":21,"score":160,"ticketId":"48522","tier":"strong"},{"opportunityKey":"core-trac:56886","opportunityRevision":"opportunity-revision-v1-9022bfc868e3fba196400a1d498f08d3","rank":22,"score":160,"ticketId":"56886","tier":"strong"},{"opportunityKey":"core-trac:44964","opportunityRevision":"opportunity-revision-v1-3b7b338c6bd3b898f4bd2118f5d04acf","rank":23,"score":158,"ticketId":"44964","tier":"strong"},{"opportunityKey":"core-trac:62744","opportunityRevision":"opportunity-revision-v1-2ad96a2e9db2ff1f66bda1512a44ea69","rank":24,"score":158,"ticketId":"62744","tier":"strong"},{"opportunityKey":"core-trac:63386","opportunityRevision":"opportunity-revision-v1-b4a4843c40f51d67256e9dde32a2253a","rank":25,"score":158,"ticketId":"63386","tier":"strong"},{"opportunityKey":"core-trac:64056","opportunityRevision":"opportunity-revision-v1-caae5268ef0e1d86c82b6b46d881f4f8","rank":26,"score":158,"ticketId":"64056","tier":"strong"},{"opportunityKey":"core-trac:64902","opportunityRevision":"opportunity-revision-v1-33f7d4540b3b3ffe61ccf227ac6caf5f","rank":27,"score":158,"ticketId":"64902","tier":"strong"},{"opportunityKey":"core-trac:65111","opportunityRevision":"opportunity-revision-v1-4e30ab378b386d9b775298956f851ebd","rank":28,"score":158,"ticketId":"65111","tier":"strong"},{"opportunityKey":"core-trac:65348","opportunityRevision":"opportunity-revision-v1-71f6b8b9f4b4d6867e7050b3e176a273","rank":29,"score":158,"ticketId":"65348","tier":"strong"},{"opportunityKey":"core-trac:65496","opportunityRevision":"opportunity-revision-v1-ad745c53055e9c3e8ae3135b04319ca4","rank":30,"score":158,"ticketId":"65496","tier":"strong"},{"opportunityKey":"core-trac:65734","opportunityRevision":"opportunity-revision-v1-3054241d8015a106845022085e7a4525","rank":31,"score":158,"ticketId":"65734","tier":"strong"},{"opportunityKey":"core-trac:65757","opportunityRevision":"opportunity-revision-v1-bf6222ebd0efb51d6a39912b1c7026f3","rank":32,"score":158,"ticketId":"65757","tier":"strong"},{"opportunityKey":"core-trac:41081","opportunityRevision":"opportunity-revision-v1-d2739cb86d0f1651bd436a1d51af4f2b","rank":33,"score":156,"ticketId":"41081","tier":"strong"},{"opportunityKey":"core-trac:60478","opportunityRevision":"opportunity-revision-v1-eabab0b52378c5064aae7f936d7aa527","rank":34,"score":156,"ticketId":"60478","tier":"strong"},{"opportunityKey":"core-trac:63109","opportunityRevision":"opportunity-revision-v1-728cfcd38efaa052420e7add4c785d70","rank":35,"score":156,"ticketId":"63109","tier":"strong"},{"opportunityKey":"core-trac:63197","opportunityRevision":"opportunity-revision-v1-9e50dae80896520f850b314cec08d73d","rank":36,"score":156,"ticketId":"63197","tier":"strong"},{"opportunityKey":"core-trac:64707","opportunityRevision":"opportunity-revision-v1-e573c83aa465a71362600a7a815e6a06","rank":37,"score":156,"ticketId":"64707","tier":"strong"},{"opportunityKey":"core-trac:41305","opportunityRevision":"opportunity-revision-v1-f6f41938518d8d76f380457946b59bb3","rank":38,"score":154,"ticketId":"41305","tier":"strong"},{"opportunityKey":"core-trac:54034","opportunityRevision":"opportunity-revision-v1-e308c29bcc8b9ebaa3867a3aaa46ddd8","rank":39,"score":154,"ticketId":"54034","tier":"strong"},{"opportunityKey":"core-trac:63256","opportunityRevision":"opportunity-revision-v1-6023ea53b9bdf1a50cbfe9d945e0a662","rank":40,"score":154,"ticketId":"63256","tier":"strong"},{"opportunityKey":"core-trac:64921","opportunityRevision":"opportunity-revision-v1-daa5a87673c64904ad3b43d02a58be81","rank":41,"score":154,"ticketId":"64921","tier":"strong"},{"opportunityKey":"core-trac:40241","opportunityRevision":"opportunity-revision-v1-5520029f884ee4c3f9361fcf54412e80","rank":42,"score":150,"ticketId":"40241","tier":"strong"},{"opportunityKey":"core-trac:43010","opportunityRevision":"opportunity-revision-v1-a61297a284e5020bf288ce5b2c3ae81d","rank":43,"score":150,"ticketId":"43010","tier":"strong"},{"opportunityKey":"core-trac:46017","opportunityRevision":"opportunity-revision-v1-ddac6579c2f89854a52d5a8746d98c5f","rank":44,"score":150,"ticketId":"46017","tier":"strong"},{"opportunityKey":"core-trac:47988","opportunityRevision":"opportunity-revision-v1-db4657a0a8e10f3819ddc662b07f3dc4","rank":45,"score":150,"ticketId":"47988","tier":"strong"},{"opportunityKey":"core-trac:54016","opportunityRevision":"opportunity-revision-v1-a6c3869a92f1cdb7ca2717095259d1b9","rank":46,"score":150,"ticketId":"54016","tier":"strong"},{"opportunityKey":"core-trac:58416","opportunityRevision":"opportunity-revision-v1-6d1cd720fb9eea15b90ad78476588023","rank":47,"score":150,"ticketId":"58416","tier":"strong"},{"opportunityKey":"core-trac:66075","opportunityRevision":"opportunity-revision-v1-5c9c726ac39ec70a25872e775a6973d2","rank":48,"score":150,"ticketId":"66075","tier":"strong"},{"opportunityKey":"core-trac:66142","opportunityRevision":"opportunity-revision-v1-a910738eef644db66673d08e9905f12f","rank":49,"score":150,"ticketId":"66142","tier":"strong"},{"opportunityKey":"core-trac:41358","opportunityRevision":"opportunity-revision-v1-06ce0826313a2b6cc1a56b75beedb836","rank":50,"score":148,"ticketId":"41358","tier":"watching"},{"opportunityKey":"core-trac:43885","opportunityRevision":"opportunity-revision-v1-8867417172419fb93e08fa2f5af6fcfc","rank":51,"score":148,"ticketId":"43885","tier":"watching"},{"opportunityKey":"core-trac:45354","opportunityRevision":"opportunity-revision-v1-a56862a1d98b254773651f421c8c6469","rank":52,"score":148,"ticketId":"45354","tier":"watching"},{"opportunityKey":"core-trac:53450","opportunityRevision":"opportunity-revision-v1-42e41d67a0f829487b37e06cb1cc056a","rank":53,"score":148,"ticketId":"53450","tier":"watching"},{"opportunityKey":"core-trac:60628","opportunityRevision":"opportunity-revision-v1-a80f87ffbae50c915416d49228e2e211","rank":54,"score":148,"ticketId":"60628","tier":"watching"},{"opportunityKey":"core-trac:64376","opportunityRevision":"opportunity-revision-v1-e2b89443bd42d37c45965cd2c05920bf","rank":55,"score":148,"ticketId":"64376","tier":"watching"},{"opportunityKey":"core-trac:65171","opportunityRevision":"opportunity-revision-v1-0e1aeb6aa9002a619d31d6bc38a6fbe4","rank":56,"score":148,"ticketId":"65171","tier":"watching"},{"opportunityKey":"core-trac:65395","opportunityRevision":"opportunity-revision-v1-06b7c88ba57ea40c3fd04b0e240c86bd","rank":57,"score":148